{
  "resumeId": "res_fixture",
  "version": 1,
  "schemaVersion": 13,
  "profile": {},
  "educations": [{ "id": "edu_01" }],
  "skills": "",
  "internships": [],
  "projects": [{
    "id": "project_01",
    "description": "实现简历编辑和导出功能。"
  }],
  "studentExperiences": [],
  "researchExperiences": [],
  "customImages": [],
  "awards": [],
  "certificates": [],
  "selfSummary": {},
  "sectionVisibility": {},
  "layout": {},
  "theme": {}
}
